{
  "fetchDate": "2026-03-22T07:00:00Z",
  "policy_rates": [
    { "currency": "USD", "value": 5.50, "diff_vs_usd": 0.00, "trend_3m": "STABLE", "last_update": "2026-02-01", "publication_lag_applied": 0, "freshness_days": 49, "is_stale": false },
    { "currency": "EUR", "value": 4.00, "diff_vs_usd": -1.50, "trend_3m": "FALLING", "last_update": "2026-03-07", "publication_lag_applied": 0, "freshness_days": 15, "is_stale": false },
    { "currency": "GBP", "value": 5.25, "diff_vs_usd": -0.25, "trend_3m": "STABLE", "last_update": "2026-02-06", "publication_lag_applied": 0, "freshness_days": 44, "is_stale": false },
    { "currency": "JPY", "value": 0.10, "diff_vs_usd": -5.40, "trend_3m": "STABLE", "last_update": "2026-01-24", "publication_lag_applied": 0, "freshness_days": 57, "is_stale": false },
    { "currency": "AUD", "value": 4.35, "diff_vs_usd": -1.15, "trend_3m": "STABLE", "last_update": "2026-03-18", "publication_lag_applied": 0, "freshness_days": 4, "is_stale": false },
    { "currency": "CAD", "value": 4.75, "diff_vs_usd": -0.75, "trend_3m": "FALLING", "last_update": "2026-03-04", "publication_lag_applied": 0, "freshness_days": 18, "is_stale": false },
    { "currency": "CHF", "value": 1.50, "diff_vs_usd": -4.00, "trend_3m": "FALLING", "last_update": "2026-03-13", "publication_lag_applied": 0, "freshness_days": 9, "is_stale": false },
    { "currency": "NZD", "value": 5.50, "diff_vs_usd": 0.00, "trend_3m": "STABLE", "last_update": "2026-02-19", "publication_lag_applied": 0, "freshness_days": 31, "is_stale": false }
  ],
  "cpi_yoy": [
    { "currency": "USD", "value": 3.1, "diff_vs_usd": 0.00, "trend_3m": "FALLING", "last_update": "2026-02-13", "publication_lag_applied": 30, "freshness_days": 37, "is_stale": false },
    { "currency": "EUR", "value": 2.6, "diff_vs_usd": -0.50, "trend_3m": "FALLING", "last_update": "2026-03-01", "publication_lag_applied": 30, "freshness_days": 21, "is_stale": false },
    { "currency": "GBP", "value": 4.0, "diff_vs_usd": 0.90, "trend_3m": "FALLING", "last_update": "2026-02-14", "publication_lag_applied": 30, "freshness_days": 36, "is_stale": false },
    { "currency": "JPY", "value": 2.2, "diff_vs_usd": -0.90, "trend_3m": "RISING", "last_update": "2026-02-27", "publication_lag_applied": 30, "freshness_days": 23, "is_stale": false },
    { "currency": "AUD", "value": 3.4, "diff_vs_usd": 0.30, "trend_3m": "FALLING", "last_update": "2026-01-29", "publication_lag_applied": 30, "freshness_days": 52, "is_stale": false },
    { "currency": "CAD", "value": 2.9, "diff_vs_usd": -0.20, "trend_3m": "FALLING", "last_update": "2026-02-20", "publication_lag_applied": 30, "freshness_days": 30, "is_stale": false },
    { "currency": "CHF", "value": 1.3, "diff_vs_usd": -1.80, "trend_3m": "FALLING", "last_update": "2026-03-04", "publication_lag_applied": 30, "freshness_days": 18, "is_stale": false },
    { "currency": "NZD", "value": 4.0, "diff_vs_usd": 0.90, "trend_3m": "FALLING", "last_update": "2026-01-24", "publication_lag_applied": 30, "freshness_days": 57, "is_stale": false }
  ],
  "yields_10y": [
    { "country": "USD", "yield": 4.32, "spread_vs_us": 0.00, "delta_1w": 0.08, "direction": "WIDENING", "last_update": "2026-03-21" },
    { "country": "EUR", "yield": 2.41, "spread_vs_us": -1.91, "delta_1w": -0.03, "direction": "NARROWING", "last_update": "2026-03-21" },
    { "country": "GBP", "yield": 4.18, "spread_vs_us": -0.14, "delta_1w": 0.05, "direction": "STABLE", "last_update": "2026-03-21" },
    { "country": "JPY", "yield": 0.76, "spread_vs_us": -3.56, "delta_1w": 0.02, "direction": "STABLE", "last_update": "2026-03-21" },
    { "country": "AUD", "yield": 4.08, "spread_vs_us": -0.24, "delta_1w": 0.06, "direction": "STABLE", "last_update": "2026-03-21" },
    { "country": "CAD", "yield": 3.58, "spread_vs_us": -0.74, "delta_1w": 0.04, "direction": "STABLE", "last_update": "2026-03-21" },
    { "country": "CHF", "yield": 0.78, "spread_vs_us": -3.54, "delta_1w": -0.02, "direction": "NARROWING", "last_update": "2026-03-21" },
    { "country": "NZD", "yield": 4.56, "spread_vs_us": 0.24, "delta_1w": 0.07, "direction": "WIDENING", "last_update": "2026-03-21" }
  ],
  "vix": {
    "value": 18.4,
    "regime": "NORMAL",
    "delta_1w": -2.1
  }
}
