{
  "fetchDate": "2026-08-07",
  "policy_rates": [
    {
      "currency": "USD",
      "value": 3.63,
      "diff_vs_usd": 0.0,
      "trend_3m": "STABLE",
      "last_update": "2026-07-01",
      "publication_lag_applied": 0,
      "freshness_days": 37,
      "is_stale": true
    },
    {
      "currency": "GBP",
      "value": 3.7298,
      "diff_vs_usd": 0.0998,
      "trend_3m": "STABLE",
      "last_update": "2026-06-01",
      "publication_lag_applied": 0,
      "freshness_days": 67,
      "is_stale": true
    },
    {
      "currency": "JPY",
      "value": 0.3,
      "diff_vs_usd": -3.33,
      "trend_3m": "STABLE",
      "last_update": "2023-12-01",
      "publication_lag_applied": 0,
      "freshness_days": 980,
      "is_stale": true
    },
    {
      "currency": "AUD",
      "value": 4.46,
      "diff_vs_usd": 0.83,
      "trend_3m": "RISING",
      "last_update": "2026-06-01",
      "publication_lag_applied": 0,
      "freshness_days": 67,
      "is_stale": true
    },
    {
      "currency": "CAD",
      "value": 5.25,
      "diff_vs_usd": 1.62,
      "trend_3m": "STABLE",
      "last_update": "2023-12-01",
      "publication_lag_applied": 0,
      "freshness_days": 980,
      "is_stale": true
    },
    {
      "currency": "CHF",
      "value": 1.34,
      "diff_vs_usd": -2.29,
      "trend_3m": "FALLING",
      "last_update": "2024-03-01",
      "publication_lag_applied": 0,
      "freshness_days": 889,
      "is_stale": true
    },
    {
      "currency": "NZD",
      "value": 4.33,
      "diff_vs_usd": 0.7,
      "trend_3m": "FALLING",
      "last_update": "2024-12-01",
      "publication_lag_applied": 0,
      "freshness_days": 614,
      "is_stale": true
    }
  ],
  "cpi_yoy": [
    {
      "currency": "USD",
      "value": 332.568,
      "diff_vs_usd": 0.0,
      "trend_3m": "RISING",
      "last_update": "2026-06-01",
      "publication_lag_applied": 2,
      "freshness_days": 67,
      "is_stale": true
    },
    {
      "currency": "EUR",
      "value": 103.0,
      "diff_vs_usd": -229.568,
      "trend_3m": "RISING",
      "last_update": "2026-06-01",
      "publication_lag_applied": 2,
      "freshness_days": 67,
      "is_stale": true
    },
    {
      "currency": "JPY",
      "value": -3.3,
      "diff_vs_usd": -335.868,
      "trend_3m": "RISING",
      "last_update": "2025-12-01",
      "publication_lag_applied": 2,
      "freshness_days": 249,
      "is_stale": true
    },
    {
      "currency": "AUD",
      "value": 0.5912786400591119,
      "diff_vs_usd": -331.9767,
      "trend_3m": "FALLING",
      "last_update": "2023-10-01",
      "publication_lag_applied": 2,
      "freshness_days": 1041,
      "is_stale": true
    },
    {
      "currency": "CAD",
      "value": 126.189364115567,
      "diff_vs_usd": -206.3786,
      "trend_3m": "RISING",
      "last_update": "2023-11-01",
      "publication_lag_applied": 2,
      "freshness_days": 1010,
      "is_stale": true
    },
    {
      "currency": "GBP",
      "value": 136.1,
      "diff_vs_usd": -196.468,
      "trend_3m": "RISING",
      "last_update": "2025-03-01",
      "publication_lag_applied": 2,
      "freshness_days": 524,
      "is_stale": true
    },
    {
      "currency": "CHF",
      "value": 107.7312,
      "diff_vs_usd": -224.8368,
      "trend_3m": "RISING",
      "last_update": "2025-04-01",
      "publication_lag_applied": 2,
      "freshness_days": 493,
      "is_stale": true
    },
    {
      "currency": "NZD",
      "value": 0.4788507581803675,
      "diff_vs_usd": -332.0891,
      "trend_3m": "FALLING",
      "last_update": "2023-10-01",
      "publication_lag_applied": 2,
      "freshness_days": 1041,
      "is_stale": true
    }
  ],
  "yields_10y": [
    {
      "country": "US",
      "yield": 4.63,
      "spread_vs_us": 0.0,
      "delta_1w": 0.0,
      "direction": "STABLE",
      "last_update": "2026-08-05"
    },
    {
      "country": "DE",
      "yield": 2.97,
      "spread_vs_us": -1.66,
      "delta_1w": -0.0765,
      "direction": "NARROWING",
      "last_update": "2026-06-01"
    },
    {
      "country": "GB",
      "yield": 4.796,
      "spread_vs_us": 0.166,
      "delta_1w": -0.1456,
      "direction": "NARROWING",
      "last_update": "2026-06-01"
    },
    {
      "country": "JP",
      "yield": 2.67,
      "spread_vs_us": -1.96,
      "delta_1w": 0.02,
      "direction": "STABLE",
      "last_update": "2026-06-01"
    }
  ],
  "vix": {
    "value": 15.15,
    "regime": "NORMAL",
    "delta_1w": -0.66
  }
}